{
  "content_sha256": "c37a6f727d935d1eeb746ebabe6c58a0b19eb32822c0c73561dbb5b0e34f68aa",
  "manifest_content": {
    "approval_id": "p1b-20260722-artifactpinningb0",
    "artifacts": [
      {
        "expected_signer_identity": "Developer ID Installer: Apple Inc. - Containerization (UPBK2H6LZM)",
        "expected_signer_team_id": "UPBK2H6LZM",
        "name": "container-1.1.0-installer-signed.pkg",
        "notarization_requirement": "required",
        "resolved_download_hosts": [
          "github.com",
          "release-assets.githubusercontent.com"
        ],
        "role": "backend-installer",
        "sha256": "0ca1c42a2269c2557efb1d82b1b38ac553e6a3a3da1b1179c439bcee1e7d6714",
        "signature_type": "apple-signed-pkg",
        "size_bytes": 89471042,
        "source_url": "https://github.com/apple/container/releases/download/1.1.0/container-1.1.0-installer-signed.pkg",
        "verification_policy_id": "apple-container-installer-v1",
        "version": "1.1.0"
      },
      {
        "expected_signer_identity": "GitHub release asset SHA-256",
        "expected_signer_team_id": "not_applicable",
        "name": "kata-static-3.28.0-arm64.tar.zst",
        "notarization_requirement": "not_applicable",
        "resolved_download_hosts": [
          "github.com",
          "release-assets.githubusercontent.com"
        ],
        "role": "linux-kernel",
        "sha256": "f63d54507d1f18635d94475077e4c2330de4d8e05cedf25f7c38f063b0e66a91",
        "signature_type": "sha256-only",
        "size_bytes": 596775193,
        "source_url": "https://github.com/kata-containers/kata-containers/releases/download/3.28.0/kata-static-3.28.0-arm64.tar.zst",
        "verification_policy_id": "apple-container-release-asset-sha256-v1",
        "version": "3.28.0+vmlinux-6.18.15-186"
      },
      {
        "expected_signer_identity": "OCI manifest digest",
        "expected_signer_team_id": "not_applicable",
        "name": "ghcr.io-apple-containerization-vminit-sha256-04cd14f8e6ec9617611429aaf2a91a841b27ff9eae847acaca48430f58c5e57d.json",
        "notarization_requirement": "not_applicable",
        "resolved_download_hosts": [
          "ghcr.io"
        ],
        "role": "init-filesystem",
        "sha256": "04cd14f8e6ec9617611429aaf2a91a841b27ff9eae847acaca48430f58c5e57d",
        "signature_type": "sha256-only",
        "size_bytes": 409,
        "source_url": "https://ghcr.io/v2/apple/containerization/vminit/manifests/sha256:04cd14f8e6ec9617611429aaf2a91a841b27ff9eae847acaca48430f58c5e57d",
        "verification_policy_id": "oci-manifest-sha256-v1",
        "version": "0.35.0-linux-arm64"
      },
      {
        "expected_signer_identity": "OCI manifest digest",
        "expected_signer_team_id": "not_applicable",
        "name": "registry.k8s.io-pause-sha256-e50b7059b633caf3c1449b8da680d11845cda4506b513ee7a2de00725f0a34a7.json",
        "notarization_requirement": "not_applicable",
        "oci_digest": "sha256:e50b7059b633caf3c1449b8da680d11845cda4506b513ee7a2de00725f0a34a7",
        "resolved_download_hosts": [
          "registry.k8s.io",
          "europe-west3-docker.pkg.dev"
        ],
        "role": "synthetic-oci-manifest",
        "sha256": "e50b7059b633caf3c1449b8da680d11845cda4506b513ee7a2de00725f0a34a7",
        "signature_type": "oci-digest",
        "size_bytes": 501,
        "source_url": "https://registry.k8s.io/v2/pause/manifests/sha256:e50b7059b633caf3c1449b8da680d11845cda4506b513ee7a2de00725f0a34a7",
        "verification_policy_id": "oci-digest-pinned-v1",
        "version": "3.10-linux-arm64"
      }
    ],
    "backend": "apple-container-cli",
    "backend_version": "1.1.0",
    "background_services": [
      "Signed package includes core plugin service configs under /usr/local/libexec/container/plugins with loadAtBoot=true and runAtLoad=false.",
      "container system start would start container-apiserver and related core services; B0 does not start them."
    ],
    "created_at": "2026-07-22T12:06:00Z",
    "disk_changes": [
      "Signed installer declares install-location /usr/local and payload paths under /usr/local/bin and /usr/local/libexec/container.",
      "Runtime may create Apple Container configuration and data directories only after approved synthetic startup, including kernel/init/cache state; B0 does not create them.",
      "Vendor uninstall path is /usr/local/bin/uninstall-container.sh from the signed package payload."
    ],
    "expires_at": "2026-07-25T12:06:00Z",
    "network_changes": [
      "NONE"
    ],
    "required_permissions": [
      "Installer package declares auth=root and requires administrator authorization for any future installation.",
      "No administrator authorization is requested or used during B0 artifact pinning."
    ],
    "rollback_plan_hash": "bf9d20be0aa5623ea817fd74d06762e69293047669c6a6c604a53b3e4f0f52d5"
  },
  "manifest_state": "READY_FOR_REVIEW",
  "schema_version": "phase1b.installation-manifest.v2"
}
